affiliated_committee_name,committee_id,committee_type,designation_type,name,organization_type,state
"CRH AMERICAS, INC.",C00346353,PAC - Qualified,Lobbyist/Registrant PAC,"CRH AMERICAS, INC. PAC",Corporation,TX
"CRICKET COMMUNICATIONS, INC.",C00435222,PAC - Qualified,Lobbyist/Registrant PAC,CRICKET COMMUNICATIONS INC. POLITICAL ACTION COMMITTEE (CRICKETPAC),Corporation,TX
CROP INSURANCE PROFESSIONALS ASSOCIATION,C00503680,PAC - Qualified,Unauthorized,CROP INSURANCE PROFESSIONALS ASSOCIATION PAC-CIPA PAC,Trade Association,DC
CROP INSURANCE AND REINSURANCE BUREAU,C00150805,PAC - Qualified,Lobbyist/Registrant PAC,CROP INSURANCE REINSURANCE BUREAU (CIRB)-PAC,Trade Association,DC
CROPLIFE AMERICA,C00248849,PAC - Qualified,Lobbyist/Registrant PAC,CROPLIFE AMERICA POLITICAL ACTION COMMITTEE,Trade Association,VA
CROSSSTATE CREDIT UNION ASSOCIATION,C00109397,PAC - Qualified,Lobbyist/Registrant PAC,CROSSSTATE CREDIT UNION ASSOCIATION POLITICAL ACTION COMMITTEE,Trade Association,PA
CROWLEY MARITIME CORPORATION FEDERAL PAC,C00147231,PAC - Qualified,Lobbyist/Registrant PAC,CROWLEY MARITIME CORPORATION FEDERAL PAC,Corporation,FL
CROWN CORK & SEAL COMPANY INC.,C00254268,PAC - Qualified,Unauthorized,CROWN CORK & SEAL COMPANY INC. PAC,Corporation,PA
CRUISE LINES INTERNATIONAL ASSOCIATION INC.,C00432393,PAC - Qualified,Lobbyist/Registrant PAC,CRUISE LINES INTERNATIONAL ASSOCIATION PAC (CLIA PAC),Trade Association,DC
CRYPTEK INC,C00386565,PAC - Nonqualified,Unauthorized,CRYPTEK POLITICAL ACTION COMMITTEE,Corporation,VA
CSL BEHRING,C00422501,PAC - Qualified,Lobbyist/Registrant PAC,CSL EMPLOYEES POLITICAL ACTION COMMITTEE,Corporation,PA
CSRA INC.,C00101410,PAC - Qualified,Lobbyist/Registrant PAC,CSRA INC. PAC,Corporation,VA
CSX CORPORATION,C00163832,PAC - Qualified,Lobbyist/Registrant PAC,CSX CORPORATION GOOD GOVERNMENT FUND,Corporation,DC
CTIA - THE WIRELESS ASSOCIATION,C00262295,PAC - Qualified,Lobbyist/Registrant PAC,CTIA - THE WIRELESS ASSOCIATION POLITICAL ACTION COMMITTEE,Trade Association,DC
CUBIC CORPORATION,C00151787,PAC - Qualified,Lobbyist/Registrant PAC,CUBIC CORPORATION EMPLOYEES' POLITICAL ACTION COMMITTEE,Corporation,CA
CUBIST PHARMACEUTICALS INC.,C00460238,PAC - Qualified,Lobbyist/Registrant PAC,CUBIST PHARMACEUTICALS INC. PAC (CUBIST PAC),Corporation,MA
CREDIT UNION NATIONAL ASSOCIATION,C00007880,PAC - Qualified,Lobbyist/Registrant PAC,CULAC THE PAC OF CREDIT UNION NATIONAL ASSOCIATION,Trade Association,DC
,C00523225,PAC - Qualified,Unauthorized,CUMBERLAND FARMS INC. POLITICAL ACTION COMMITTEE (CUMBERLAND FARMS PAC),Corporation,MA
CUMMINS-ALLISON CORP.,C00408914,PAC - Qualified,Unauthorized,CUMMINS-ALLISON CORP EMPLOYEES FOR GOOD GOVERNMENT,Corporation,IL
CUMMINS INC.,C00377952,PAC - Qualified,Lobbyist/Registrant PAC,CUMMINS INC. POLITICAL ACTION COMMITTEE (CIPAC),Corporation,DC
CUNA MUTUAL HOLDING COMPANY,C00402107,PAC - Qualified,Lobbyist/Registrant PAC,CUNA MUTUAL HOLDING COMPANY POLITICAL ACTION COMMITTEE (CUNA MUTUAL PAC),Corporation,WI
CURTISS WRIGHT CORPORATION,C00420596,PAC - Qualified,Lobbyist/Registrant PAC,CURTISS WRIGHT CORPORATION EMPLOYEES POLITICAL ACTION COMMITTEE,Corporation,NC
CVS HEALTH,C00384818,PAC - Qualified,Lobbyist/Registrant PAC,CVS HEALTH PAC,Corporation,DC
C.V. STARR & CO. INC.,C00462465,PAC - Nonqualified,Unauthorized,C.V. STARR & CO. INC. POLITICAL ACTION COMMITTEE,Corporation,NY
CYBERONICS INC,C00481291,PAC - Nonqualified,Unauthorized,CYBERONICS INC FEDERAL POLITICAL ACTION COMMITTEE,Corporation,TX
CYTEC ENGINEERED MATERIALS INC.,C00425355,PAC - Nonqualified,Unauthorized,CYTEC ENGINEERED MATERIALS POLITICAL ACTION COMMITTEE AKA CEM PAC,Corporation,AZ
HOUSTON FIRE FIGHTERS POLITICAL ACTION FUND,C00130187,PAC - Qualified,Unauthorized,"DADE COUNTY FIRE FIGHTERS, LOCAL 1403 PAC",Labor Organization,FL
"DAIICHI SANKYO, INC.",C00441204,PAC - Qualified,Lobbyist/Registrant PAC,"DAIICHI SANKYO, INC. EMPLOYEE POLITICAL ACTION COMMITTEE",Corporation,NJ
"DAIRY FARMERS OF AMERICA, INC.",C00001388,PAC - Qualified,Lobbyist/Registrant PAC,"DAIRY FARMERS OF AMERICA, INC. POLITICAL ACTION COMMITTEE; AKA DFA-PAC",Cooperative,KS
"DAIRY FARMERS OF AMERICA, INC. - DEPAC (DAIRY EDUCATIONAL POLITICAL ACTION COMMITTEE)",C00143818,PAC - Qualified,Unauthorized,DAIRYLEA COOPERATIVE POLITICAL ACTION COMMITTEE,Cooperative,NY
DALLAS-FT WORTH ASSOCIATION OF MORTGAGE BROKERS,C00380659,PAC - Nonqualified,Unauthorized,DALLAS-FT WORTH ASSOCIATION OF MORTGAGE BROKERS POLITICAL ACTION COMMITTEE,Membership Organization,TX
NONE,C00356477,PAC - Nonqualified,Unauthorized,DALLAS SAFARI CLUB PAC,Membership Organization,TX
"DARDEN RESTAURANTS, INC.",C00108282,PAC - Qualified,Lobbyist/Registrant PAC,"DARDEN RESTAURANTS, INC. EMPLOYEES GOOD GOVERNMENT FUND",Corporation,FL
,C00022756,PAC - Qualified,Unauthorized,DARIGOLD POLITICAL ACTION COMMITTEE FKA NORTH PACIFIC DAIRY,Cooperative,WA
"DAVID VOLKERT & ASSOCIATES, INC.",C00368902,PAC - Qualified,Unauthorized,"DAVID VOLKERT & ASSOCIATES, INC. POLITICAL ACTION COMMITTEE ('DVA/HC PAC')",Corporation,AL
DAVITA INC.,C00340943,PAC - Qualified,Lobbyist/Registrant PAC,DAVITA INC. POLITICAL ACTION COMMITTEE (DAPAC),Corporation,WA
THE AES CORPORATION POLITICAL ACTION COMMITTEE,C00102947,PAC - Qualified,Lobbyist/Registrant PAC,DAYTON POWER AND LIGHT COMPANY RESPONSIBLE CITIZENSHIP FUND; THE,Corporation,OH
"DAY & ZIMMERMANN, INC.",C00341271,PAC - Qualified,Unauthorized,DAY & ZIMMERMANN INC FEDERAL PAC (AKA 'DAYPAC - FEDERAL'),Corporation,PA
DBA INTERNATIONAL,C00444497,PAC - Nonqualified,Unauthorized,DBA INTERNATIONAL POLITICAL ACTION COMMITTEE (DBA PAC),Trade Association,VA
DEAN FOODS,C00340083,PAC - Qualified,Lobbyist/Registrant PAC,DEAN FOODS COMPANY POLITICAL ACTION COMMITTEE,Corporation,TX
DEAN OPERATIONS INC,C00084285,PAC - Qualified,Unauthorized,DEAN OPERATIONS INC PAC (DEANPAC),Corporation,MO
NONE,C00414888,PAC - Qualified,Unauthorized,DECLARATION ALLIANCE PAC,Corporation w/o capital stock,VA
DEERE & COMPANY,C00204099,PAC - Qualified,Lobbyist/Registrant PAC,DEERE & COMPANY PAC (AKA JOHN DEERE PAC),Corporation,IL
DEFENDERS OF WILDLFIE ACTION FUND,C00503318,PAC - Nonqualified,Lobbyist/Registrant PAC,DEFENDERS OF WILDLIFE ACTION FUND PAC,Membership Organization,DC
NONE,C00127910,PAC - Qualified,Unauthorized,DELAWARE BANKERS ASSOCIATION DELBANKPAC - F FUND,Trade Association,DE
"DELAWARE NORTH COMPANIES, INCORPORATED",C00158899,PAC - Qualified,Unauthorized,DELAWARE NORTH COMPANIES INCORPORATED POLITICAL ACTION COMMITTEE,Corporation,NY
"DELAWARE NORTH COMPANIES, INC.",C00532887,PAC - Qualified,Unauthorized,"DELAWARE NORTH COMPANIES, INC. POLITICAL ACTION COMMITTEE",Corporation,NY
BLANK,C00152579,PAC - Qualified,Unauthorized,DELAWARE VALLEY POLITICAL ACTION COMMITTEE,Membership Organization,PA
,C00428060,PAC - Nonqualified,Unauthorized,DELEX SYSTEMS INCORPORATED PAC,Corporation,VA
"DELL TECHNOLOGIES, INC.",C00369751,PAC - Qualified,Lobbyist/Registrant PAC,"DELL TECHNOLOGIES, INC. POLITICAL ACTION COMMITTEE",Corporation,DC
DELPHI FINANCIAL GROUP INC,C00230631,PAC - Nonqualified,Unauthorized,DELPHI FINANCIAL GROUP INC POLITICAL ACTION COMMITTEE,Corporation,PA
DELTA AIRLINES,C00104802,PAC - Qualified,Lobbyist/Registrant PAC,DELTA AIR LINES PAC,Corporation,DC
DELTA DENTAL PLANS ASSOCIATION,C00213819,PAC - Qualified,Lobbyist/Registrant PAC,DELTA DENTAL PLANS ASSOCIATION PAC,Trade Association,IL
,C00492264,PAC - Nonqualified,Unauthorized,DEM CD CONGRESS CENTRAL VALLEY,Membership Organization,CA
NONE,C00434118,PAC - Nonqualified,Unauthorized,DEMOCRACY 1ST,Membership Organization,LA
"DEMOCRACY ENGINE, INC.",C00468314,PAC - Nonqualified,Unauthorized,"DEMOCRACY ENGINE, INC., PAC",Corporation,DC
,C00432369,PAC - Nonqualified,Unauthorized,DEMOCRACY FOR LOUISIANA,Cooperative,LA
,C00018135,PAC - Qualified,Unauthorized,DEMOCRATIC CANDIDATE FUND,Membership Organization,MD
,C00419572,PAC - Qualified,Unauthorized,"DEMOCRATIC SOCIALISTS OF AMERICA, INC. PAC",Corporation,NY
,C00403824,PAC - Nonqualified,Unauthorized,DEMOCRATIC WOMEN OF WESTPORT,Membership Organization,CT
,C00164459,PAC - Qualified,Unauthorized,DEMOCRATIC WOMEN'S FORUM OF SAN FRANCISCO,Membership Organization,CA
,C00407676,PAC - Nonqualified,Unauthorized,DEMOCRATS OF THE CLAREMONT COLLEGES,Membership Organization,CA
DENBURY INC.,C00440651,PAC - Qualified,Unauthorized,DENBURY INC POLITICAL COMMITTEE,Corporation,TX
DENTONS COHEN & GRIGSBY P.C.,C00195362,PAC - Qualified,Unauthorized,"DENTONS COHEN & GRIGSBY P.C., POLITICAL ACTION COMMITTEE",Corporation,PA
THE DEPOSITORY TRUST AND CLEARING CORPORATION,C00497917,PAC - Qualified,Lobbyist/Registrant PAC,DEPOSITORY TRUST AND CLEARING CORPORATION PAC - DTCC PAC; THE,Corporation,DC
DESERT GRAPE GROWERS LEAGUE/CALIFORNIA,C00154641,PAC - Qualified,Unauthorized,DESERT GRAPE GROWERS LEAGUE OF CALIFORNIA POLITICAL ACTION COMMITTEE,Corporation w/o capital stock,CA
DETROIT REGIONAL CHAMBER,C00366872,PAC - Nonqualified,Unauthorized,DETROIT REGIONAL CHAMBER FED PAC,Membership Organization,MI
DEUTSCHE BANK AMERICAS CORP.,C00428896,PAC - Qualified,Lobbyist/Registrant PAC,DEUTSCHE BANK AMERICAS CORP. POLITICAL ACTION COMMITTEE,Corporation,NY
DEVON ENERGY CORPORATION,C00354753,PAC - Qualified,Lobbyist/Registrant PAC,DEVON ENERGY CORPORATION POLITICAL ACTION COMMITTEE (DEC PAC),Corporation,OK
DEXTER APACHE HOLDINGS INC,C00523613,PAC - Qualified,Unauthorized,DEXTER APACHE HOLDINGS INC PAC ('DEXTER APACHE PAC'),Corporation,IA
"DIRECTORS GUILD OF AMERICA, INC.",C00311944,PAC - Qualified,Lobbyist/Registrant PAC,DGA-PAC THE POLITICAL ACTION COMMITTEE OF THE DIRECTORS GUILD OF AMERICA INC.,Labor Organization,CA
DIAGEO NORTH AMERICA,C00464628,PAC - Qualified,Unauthorized,DIAGEO NORTH AMERICA EMPLOYEES CONNECTICUT POLITICAL PARTICIPATION CMTE,Corporation,CT
"DIAGEO NORTH AMERICA, INC.",C00034470,PAC - Qualified,Lobbyist/Registrant PAC,"DIAGEO NORTH AMERICA, INC.  EMPLOYEES' POLITICAL PARTICIPATION COMMITTEE",Corporation,NY
THE DIAL CORPORATION,C00321083,PAC - Qualified,Unauthorized,DIAL CORPORATION EMPLOYEES' POLITICAL ACTION COMMITTEE,Corporation,AZ
"DIAMONDBACK ENERGY, INC.",C00135855,PAC - Qualified,Unauthorized,"DIAMONDBACK ENERGY, INC. POLITICAL ACTION COMMITTEE (DIAMONDBACK ENERGY PAC)",Corporation,TX
,C00126466,PAC - Qualified,Unauthorized,DIAMOND FOODS LLC POLITICAL ACTION COMMITTEE,Corporation,CA
"DICKIE, MCCAMEY & CHILCOTE, PC",C00169441,PAC - Qualified,Unauthorized,"DICKIE, MCCAMEY & CHILCOTE, PC POLITICAL ACTION COMMITTEE",Corporation,PA
BLANK ROME PAC,C00110197,PAC - Qualified,Lobbyist/Registrant PAC,DICKSTEIN SHAPIRO LLP PAC,Corporation,DC
DIGIMARC CORPORATION,C00434779,PAC - Nonqualified,Unauthorized,DIGIMARC CORPORATION POLITICAL ACTION COMMITTEE,Corporation,OR
DIGITAL MEDIA ASSOCIATION,C00452144,PAC - Nonqualified,Lobbyist/Registrant PAC,DIGITAL MEDIA ASSOCIATION POLITICAL ACTION COMMITTEE,Trade Association,DC
"DIMENSION4, INC.",C00401091,PAC - Qualified,Unauthorized,DIMENSION4 INC PAC,Corporation,WA
"DINEEQUITY, INC.",C00530691,PAC - Nonqualified,Lobbyist/Registrant PAC,"DINEEQUITY, INC POLITICAL ACTION COMMITTEE",Corporation,CA
DIRECT ENERGY,C00502914,PAC - Qualified,Unauthorized,DIRECT ENERGY EMPLOYEE POLITICAL ACTION COMMITTEE (DEEPAC),Corporation,TX
DIRECT SELLING ASSOCIATION,C00078535,PAC - Qualified,Lobbyist/Registrant PAC,DIRECT SELLING ASSOCIATION POLITICAL ACTION COMMITTEE,Trade Association,DC
"DIRECT SUPPLY, INC.",C00409516,PAC - Qualified,Lobbyist/Registrant PAC,"DIRECT SUPPLY, INC. PARTNERS PAC (DSI PARTNERS PAC)",Corporation,WI
"THE DIRECTV GROUP, INC.",C00331991,PAC - Qualified,Lobbyist/Registrant PAC,"DIRECTV GROUP, INC. FUND - FEDERAL (DIRECTV PAC)",Corporation,TX
DIRECT MARKETING ASSOCIATION,C00235309,PAC - Qualified,Lobbyist/Registrant PAC,"DIRECT VOICE, THE POLITICAL ACTION COMMITTEE OF THE DIRECT MARKETING ASSOCIATION",Trade Association,VA
DISCOVER FINANCIAL SERVICES,C00438051,PAC - Qualified,Lobbyist/Registrant PAC,DISCOVER FINANCIAL SERVICES POLITICAL ACTION COMMITTEE,Corporation,DC
DISTILLED SPIRITS COUNCIL OF THE UNITED STATES INC POLITICAL ACTION COMMITTEE,C00030734,PAC - Qualified,Lobbyist/Registrant PAC,DISTILLED SPIRITS COUNCIL OF THE UNITED STATES INC POLITICAL ACTION COMMITTEE,Trade Association,DC
,C00034066,PAC - Qualified,Unauthorized,DISTRICT 1199C NAT'L UNION OF HOSPITAL & HEALTH CARE EMPLOYEES POLITICAL ACTION FUND,Labor Organization,PA
"DISTRICT 1199J,NUHHCE,AFSCME,AFL-CIO",C00079327,PAC - Qualified,Unauthorized,"DISTRICT 1199J,NUHHCE,AFSCME,AFL-CIO",Labor Organization,NJ
DISTRICT 2ATTWIESI VOLUNTARY POLITICAL ACTION FUND,C00342105,PAC - Qualified,Lobbyist/Registrant PAC,DISTRICT 2A TTWISEU VOLUNTARY POLITICAL ACTION FUND,Labor Organization,FL
AMERICAN FEDERATION OF STATE COUNTY & MUNICIPAL EMPLOYEES  P E O P L E,C00149211,PAC - Qualified,Unauthorized,DISTRICT COUNCIL 37 AFSCME PUBLIC EMPLOYEES ORGANIZED FOR POL & LEG EQUALITY (DC37PEOPLE),Labor Organization,NY
NONE,C00485045,PAC - Nonqualified,Unauthorized,DISTRICT COUNCIL 9 POLITICAL ACTION FUND,Labor Organization,PA
"DISTRICT NO.1 - PCD, MEBA (MARINE ENGINEERS' BENEFICIAL ASSOCIATION)",C00003863,PAC - Qualified,Lobbyist/Registrant PAC,"DISTRICT NO. 1-PCD, MARINE ENGINEERS' BENEFICIAL ASSOCIATION - RETIREES' GROUP FUND (MEBA-RGF)",Labor Organization,DC
"DISTRICT NO.1-PCD, MEBA (MARINE ENGINEERS' BENEFICIAL ASSOCIATION)",C00279380,PAC - Qualified,Lobbyist/Registrant PAC,"DISTRICT NO. 1-PCD, MARINE ENGINEERS' BENEFICIAL ASSOC. - POLITICAL ACTION FUND (MEBA-PAF)",Labor Organization,DC
,C00286419,PAC - Qualified,Unauthorized,DISTRICT NO 5 ITPE-NMU/MEBA POLITICAL ACTION COMMITTEE DBA ITPE PAC,Labor Organization,GA
,C00307223,PAC - Qualified,Unauthorized,DISTRICT OF COLUMBIA BUILDING INDUSTRY ASSOCIATION POLITICAL ACTION COMMITTEE,Trade Association,DC
DIVERSICARE HEALTHCARE INC.,C00421735,PAC - Qualified,Unauthorized,DIVERSICARE HEALTHCARE INC. POLITICAL ACTION COMMITTEE,Corporation,TN
DOLAN MEDIA COMPANY,C00458869,PAC - Nonqualified,Unauthorized,DOLAN MEDIA COMPANY POLITICAL ACTION COMMITTEE: AKA DOLAN MEDIA PAC,Corporation,MN
,C00109363,PAC - Qualified,Unauthorized,DOLE FOOD COMPANY INC P A C,Corporation,CA
DOLLAR SAVINGS BANK,C00151563,PAC - Qualified,Unauthorized,DOLLAR SAVINGS BANK POLITICAL ACTION COMMITTEE (DOLPAC),Corporation w/o capital stock,PA
DOLLAR THRIFTY AUTOMOTIVE GROUP INC PAC (DTAG PAC),C00341552,PAC - Qualified,Lobbyist/Registrant PAC,DOLLAR THRIFTY AUTOMOTIVE GROUP INC PAC (DTAG PAC),Corporation,OK
DOMESTIC ENERGY PRODUCERS ALLIANCE,C00484725,PAC - Qualified,Unauthorized,DOMESTIC ENERGY PRODUCERS ALLIANCE PAC (DEPA PAC),Trade Association,OK
"DOMINION ENERGY, INC.",C00108209,PAC - Qualified,Lobbyist/Registrant PAC,"DOMINION ENERGY, INC. POLITICAL ACTION COMMITTEE - DOMINION PAC",Corporation,VA
SCANA CORPORATION,C00200907,PAC - Qualified,Lobbyist/Registrant PAC,DOMINION ENERGY INC. SCANA POLITICAL ACTION COMMITTEE,Corporation,SC
DOMINION QUESTAR CORPORATION EMPLOYEE POLITICAL ACTION COMMITTEE,C00097758,PAC - Qualified,Unauthorized,DOMINION QUESTAR CORPORATION EMPLOYEE POLITICAL ACTION COMMITTEE,Corporation,UT
REFINED SUGARS INC,C00352591,PAC - Nonqualified,Unauthorized,DOMINO PAC,Corporation,NY
NONE,C00018945,PAC - Qualified,Unauthorized,DORSEY NATIONAL FUND,Corporation w/o capital stock,MN
DOUBLE ROCK CORPORATION,C00423616,PAC - Nonqualified,Unauthorized,DOUBLE ROCK CORPORATION POLITICAL COMMITTEE,Corporation,NY
DOUGLASS DISTRIBUTING CARRIERS INC,C00530741,PAC - Nonqualified,Unauthorized,DOUGLASS DISTRIBUTING CARRIER INC POLITICAL ACTION COMMITTEE,Corporation,TX
DOW CORNING CORPORATION,C00386672,PAC - Qualified,Lobbyist/Registrant PAC,DOW CORNING CORPORATION LEGISLATIVE ACTION TEAM,Corporation,MI
DOW INC.,C00074096,PAC - Qualified,Lobbyist/Registrant PAC,DOW INC. PAC (DOWPAC),Corporation,MI
,C00417915,PAC - Nonqualified,Lobbyist/Registrant PAC,DPWN HOLDINGS (USA) INC/DHL POLITICAL ACTION COMMITTEE,Corporation,DC
INTERNATIONAL BROTHERHOOD OF TEAMSTERS,C00032979,PAC - Qualified,Unauthorized,"D.R.I.V.E. - DEMOCRAT, REPUBLICAN, INDEPENDENT VOTER EDUCATION (THE PAC OF THE INTERNATIONAL BROTHERHOOD OF TEAMSTERS)",Labor Organization,DC
,C00000489,PAC - Nonqualified,Unauthorized,D R I V E POLITICAL FUND CHAPTER 886,Labor Organization,OK
"DRUMMOND COMPANY, INC.",C00160630,PAC - Qualified,Unauthorized,"DRUMMOND COMPANY, INC. POLITICAL ACTION COMMITTEE (DPAC)",Corporation,AL
DTE ENERGY COMPANY,C00081547,PAC - Qualified,Lobbyist/Registrant PAC,DTE ENERGY COMPANY POLITICAL ACTION COMMITTEE,Corporation,MI
NONE,C00364133,PAC - Qualified,Lobbyist/Registrant PAC,DUANE MORRIS GOVERNMENT COMMITTEE,Corporation,PA
THE DUCHOSSOIS GROUP,C00212308,PAC - Qualified,Unauthorized,DUCHOSSOIS GROUP PAC,Corporation w/o capital stock,IL
DUKE ENERGY CORPORATION,C00083535,PAC - Qualified,Lobbyist/Registrant PAC,DUKE ENERGY CORPORATION PAC,Corporation,DC
DUKE ENERGY CORPORATION,C00091884,PAC - Qualified,Unauthorized,DUKE ENERGY CORPORATION PROGRESS PAC,Corporation,NC
"PIEDMONT NATURAL GAS COMPANY, INC.",C00144824,PAC - Qualified,Unauthorized,"DUKE ENERGY PIEDMONT NATURAL GAS COMPANY, INC. PAC",Corporation,NC
DULCICH INC. DBA PACIFIC SEAFOOD GROUP,C00475350,PAC - Qualified,Unauthorized,DULCICH INC DBA PACIFIC SEAFOOD GROUP EMPLOYEE PAC,Corporation,OR
"DUNKIN' BRANDS, INC.",C00431544,PAC - Qualified,Lobbyist/Registrant PAC,"DUNKIN' BRANDS, INC, POLITICAL ACTION COMMITTEE (DUNKIN' PAC)",Corporation,MA
DUPAGE MEDICAL GROUP LTD,C00435982,PAC - Qualified,Unauthorized,DUPAGE MEDICAL GROUP LTD PAC,Corporation,IL
DYNAMIC THERAPY SERVICES,C00436907,PAC - Nonqualified,Unauthorized,DYNAMIC THERAPY SERVICES POLITICAL ACTION COMMITTEE,Corporation,PA
,C00495341,PAC - Nonqualified,Unauthorized,DYNAMIS INC PAC,Corporation,MA
DYNCORP INTERNATIONAL LLC,C00409979,PAC - Qualified,Lobbyist/Registrant PAC,DYNCORP INTERNATIONAL LLC POLITICAL ACTION COMMITTEE (DIPAC),Corporation,VA
DYNEGY INC.,C00350363,PAC - Qualified,Unauthorized,DYNEGY INC. POLITICAL ACTION COMMITTEE,Corporation,TX
LEIDOS INC. POLITICAL ACTION COMMITTEE,C00380709,PAC - Nonqualified,Unauthorized,DYNETICS INC POLITCAL ACTION COMMITTEE,Corporation,AL
EAGLE FORUM,C00103937,PAC - Qualified,Unauthorized,EAGLE FORUM PAC,Membership Organization,IL
EASTMAN KODAK COMPANY,C00297085,PAC - Qualified,Lobbyist/Registrant PAC,EASTMAN KODAK COMPANY EMPLOYEE POLITICAL ACTION COMMITTEE,Corporation,NY
EASTMAN CHEMICAL COMPANY,C00113159,PAC - Qualified,Lobbyist/Registrant PAC,EASTMANPAC-POLITICAL ACTION COMMITTEE OF EASTMAN CHEMICAL COMPANY,Corporation,TN
,C00251132,PAC - Qualified,Unauthorized,EAT'N PARK RESTAURANTS INC POLITICAL ACTION COMMITTEE,Corporation,PA
EATON CORPORATION,C00034827,PAC - Qualified,Unauthorized,EATON CORPORATION PUBLIC POLICY ASSOCIATION,Corporation,OH
"EBAY, INC.",C00342394,PAC - Qualified,Lobbyist/Registrant PAC,EBAY INC-COMMITTEE FOR RESPONSIBLE INTERNET COMMERCE,Corporation,CA
DISH NETWORK CORPORATION,C00330647,PAC - Qualified,Lobbyist/Registrant PAC,ECHOSTAR CORPORATION AND DISH NETWORK CORPORATION PAC (ECHOSTAR DISH NETWORK PAC),Corporation,DC
ECOLAB INC.,C00101485,PAC - Qualified,Lobbyist/Registrant PAC,ECOLAB INC. POLITICAL ACTION COMMITTEE,Corporation,MN
ECOLOGY & ENVIRONMENT INC,C00147918,PAC - Nonqualified,Unauthorized,ECOLOGY AND ENVIRONMENT COMMITTEE FOR RESPONSIBLE GOVERNMENT,Corporation,NY
"EDF RENEWABLES, INC.",C00523233,PAC - Qualified,Unauthorized,"EDF RENEWABLES, INC. PAC",Corporation,OR
EDISON INTERNATIONAL,C00019653,PAC - Qualified,Lobbyist/Registrant PAC,EDISON INTERNATIONAL PAC,Corporation,CA
"EDISONLEARNING, INC. POLITICAL ACTION COMMITTEE",C00413583,PAC - Nonqualified,Unauthorized,"EDISONLEARNING, INC. POLITICAL ACTION COMMITTEE",Corporation,TN
EDP RENEWABLES NORTH AMERICA LLC,C00452755,PAC - Qualified,Unauthorized,EDP RENEWABLES NORTH AMERICA LLC PAC (AKA EDPR NA PAC),Corporation,TX
EDS,C00111658,PAC - Qualified,Lobbyist/Registrant PAC,EDS PAC,Corporation,DC
EDUCATION MANAGEMENT CORPORATION,C00466169,PAC - Qualified,Unauthorized,EDUCATION MANAGEMENT CORPORATION EMPLOYEE PAC (EDMC EDU-PAC),Corporation,PA
EDWARDS LIFESCIENCES,C00411900,PAC - Qualified,Lobbyist/Registrant PAC,EDWARDS LIFESCIENCES POLITICAL ACTION COMMITTEE (A.K.A. EDWARDS PAC),Corporation,CA
THE PARALEGAL OFFICES OF THE EFFECTIVE ASSISTANT TO COUNSEL INCORPORATED,C00536532,PAC - Nonqualified,Unauthorized,EFFECTIVE ASSISTANT TO COUNSEL-PAC; THE (LEGAL ASSISTANCE WORKFORCE),Corporation,MD
EHEALTH INC.,C00459289,PAC - Qualified,Lobbyist/Registrant PAC,EHEALTH INC. POLITICAL ACTION COMMITTEE (EHEALTH PAC),Corporation,CA
NONE,C00483966,PAC - Nonqualified,Unauthorized,EINHORN YAFFE PRESCOTT ARCHITECTURE AND ENGINEERING PC PAC,Corporation,NY
EISAI INC.,C00429886,PAC - Qualified,Lobbyist/Registrant PAC,EISAI INC. PAC,Corporation,NJ
ELBIT SYSTEMS OF AMERICA LLC,C00437566,PAC - Qualified,Lobbyist/Registrant PAC,ELBIT SYSTEMS OF AMERICA LLC POLITICAL ACTION COMMITTEE,Corporation,TX
IBEW LOCAL UNION NO 1,C00041939,PAC - Qualified,Unauthorized,"ELECTRICAL WORKERS VOLUNTARY, POL, EDU & LEG FUND IBEW LOCAL UNION NO 1",Labor Organization,MO
ELECTRIC COOPERATIVES OF MISSISSIPPI,C00004952,PAC - Qualified,Unauthorized,ELECTRIC COOPERATIVES OF MISSISSIPPI ACTION COMMITTEE FOR RURAL ELECTRIFICATION,Corporation,MS
ENERGY FUTURE HOLDINGS CORP.,C00255992,PAC - Qualified,Unauthorized,ELECTRIC DELIVERY POLITICAL ACTION COMMITTEE OF ENERGY FUTURE HOLDINGS CORP.,Corporation w/o capital stock,TX
,C00216341,PAC - Qualified,Unauthorized,ELECTRIC EMPLOYEES COMMITTEE OF THE UNITED ILLUMINATING COMPANY,Corporation,CT
ELECTRIC POWER SUPPLY ASSOCIATION,C00326009,PAC - Qualified,Lobbyist/Registrant PAC,ELECTRIC POWER SUPPLY ASSOCIATION POLITICAL ACTION COMMITTEE,Trade Association,DC
NONE,C00363192,PAC - Qualified,Unauthorized,ELECTRONIC RETAILING ASSOCIATION (E-RETAIL PAC),Trade Association,VA
"ELECTRONIC SECURITY ASSOCIATION, INC.",C00443291,PAC - Nonqualified,Unauthorized,"ELECTRONIC SECURITY ASSOCIATION, INC. PAC (ESA PAC)",Trade Association,TX
ELECTRICAL WORKERS; INT'L BROTH'D OF,C00136689,PAC - Qualified,Unauthorized,ELECTROPAC,Labor Organization,FL
IBEW LOCAL UNION 728,C00113225,PAC - Qualified,Unauthorized,ELECTROPAC 728 (INTERNATIONAL BROTHERHOOD OF ELECTRICAL WORKERS LOCAL 728),Labor Organization,FL
ALABAMA FARMERS FEDERATION *,C00094573,PAC - Qualified,Unauthorized,ELECT - THE PAC OF THE ALABAMA FARMERS FEDERATION,Corporation,AL
"ELEVANCE HEALTH, INC.",C00197228,PAC - Qualified,Lobbyist/Registrant PAC,"ELEVANCE HEALTH, INC. POLITICAL ACTION COMMITTEE (ELEVANCE HEALTH PAC)",Corporation,DC
ELI LILLY AND COMPANY,C00082792,PAC - Qualified,Lobbyist/Registrant PAC,ELI LILLY AND COMPANY POLITICAL ACTION COMMITTEE,Corporation,IN
EL PASO CORPORATION,C00093948,PAC - Qualified,Lobbyist/Registrant PAC,EL PASO CORPORATION PAC,Corporation,TX
,C00412247,PAC - Qualified,Lobbyist/Registrant PAC,EMBLEMHEALTH SERVICES COMPANY LLC FEDERAL PAC (AKA EMBLEMHEALTH PAC),Corporation w/o capital stock,NY
"EVE HOLDING, INC",C00472225,PAC - Qualified,Lobbyist/Registrant PAC,"EMBRAER AIRCRAFT HOLDING, INC. - EVE HOLDING, INC. POLITICAL ACTION COMMITTEE (?EMBRAER-EVE PAC?)",Corporation,FL
EM BUSINESS HOLDINGS INC,C00458026,PAC - Nonqualified,Unauthorized,"EM BUSINESS HOLDINGS, INC POLITICAL ACTION COMMITTEE",Corporation,VA
EMC CORPORATION,C00385948,PAC - Qualified,Lobbyist/Registrant PAC,EMC CORPORATION POLITICAL ACTION COMMITTEE,Corporation,MA
"EMD SERONO, INC.",C00258236,PAC - Qualified,Lobbyist/Registrant PAC,"EMD SERONO, INC. POLITICAL ACTION COMMITTEE",Corporation,MA
EMERGENCY DEPARTMENT PRACTICE MANAGEMENT ASSOCIATION PAC (EDPMA-PAC),C00388470,PAC - Qualified,Lobbyist/Registrant PAC,EMERGENCY DEPARTMENT PRACTICE MANAGEMENT ASSOCIATION PAC (EDPMA-PAC),Trade Association,VA
EMERGENT BIOSOLUTIONS INC.,C00380303,PAC - Qualified,Lobbyist/Registrant PAC,EMERGENT BIOSOLUTIONS INC. EMPLOYEES PAC,Corporation,MD
EMERGEORTHO PA,C00418582,PAC - Qualified,Unauthorized,EMERGEORTHO P.A. POLITICAL ACTION COMMITTEE,Membership Organization,NC
"EMGAGE ACTION, INC.",C00453704,Hybrid PAC (with Non-Contribution Account) - Nonqualified,Unauthorized,EMGAGE FEDERAL POLITICAL ACTION COMMITTEE,Membership Organization,FL
EMPIRE DISTRICT ELECTRIC COMPANY AND LIBERTY UTILITIES CO. POLITICAL ACTION COMMITTEE D/B/A LIBERTY UTILITIES PAC,C00208249,PAC - Qualified,Unauthorized,EMPIRE DISTRICT ELECTRIC COMPANY AND LIBERTY UTILITIES CO. POLITICAL ACTION COMMITTEE D/B/A LIBERTY UTILITIES PAC,Corporation,MO
,C00491423,PAC - Nonqualified,Unauthorized,EMPIRE STATE REGIONAL COUNCIL OF CARPENTERS OF POLITICAL FUND,Labor Organization,NY
EMPIRE STATE REGIONAL COUNCIL OF CARPENTERS,C00208819,PAC - Qualified,Unauthorized,EMPIRE STATE REGIONAL COUNCIL OF CARPENTERS POLITICAL ACTION FUND - FEDERAL,Labor Organization,NY
EMPLOYEE OWNED S CORPORATIONS OF AMERICA,C00458257,PAC - Qualified,Lobbyist/Registrant PAC,EMPLOYEE OWNED S CORPORATIONS OF AMERICA PAC (ESCA PAC),Trade Association,DC
"FREEPORT-MCMORAN COPPER & GOLD, INC.",C00033456,PAC - Qualified,Unauthorized,EMPLOYEES FUND FOR GOOD GOVERNMENT,Corporation,AZ
"DUPONT DE NEMOURS, INC.",C00171926,PAC - Qualified,Lobbyist/Registrant PAC,"EMPLOYEES OF DUPONT PAC - DUPONT DE NEMOURS, INC.",Corporation,DC
NORTHROP GRUMMAN CORPORATION,C00088591,PAC - Qualified,Lobbyist/Registrant PAC,EMPLOYEES OF NORTHROP GRUMMAN CORPORATION PAC,Corporation,VA
PALANTIR TECHNOLOGIES INC.,C00498691,PAC - Nonqualified,Lobbyist/Registrant PAC,EMPLOYEES OF PALANTIR TECHNOLOGIES INC. PAC,Corporation,DC
RTX CORPORATION,C00097568,PAC - Qualified,Lobbyist/Registrant PAC,EMPLOYEES OF RTX CORPORATION POLITICAL ACTION COMMITTEE,Corporation,VA
,C00163873,PAC - Qualified,Unauthorized,EMPLOYERS MUTUAL CASUALTY COMPANY COMMITTEE FOR RESPONSIBLE FEDERAL GOVERNMENT,Corporation,IA
ENBRIDGE (U.S.) INC.,C00429662,PAC - Qualified,Lobbyist/Registrant PAC,ENBRIDGE (U.S.) INC. POLITICAL ACTION COMMITTEE (ENBRIDGE-DCP PAC),Corporation,TX
ENCOMPASS HEALTH CORPORATION,C00414649,PAC - Qualified,Lobbyist/Registrant PAC,ENCOMPASS HEALTH CORPORATION POLITICAL ACTION COMMITTEE,Corporation,AL
