affiliated_committee_name,committee_id,committee_type,designation_type,name,organization_type,state
NONE,C00398909,PAC - Qualified,Lobbyist/Registrant PAC,PERENNIAL STRATEGY GROUP PAC,Corporation,DC
PERFORMANT FINANCIAL CORPORATION,C00411199,PAC - Qualified,Unauthorized,PERFORMANT FINANCIAL CORPORATION POLITICAL ACTION COMMITTEE,Corporation,CA
PERMA-FIX ENVIRONMENTAL SERVICES INC,C00516518,PAC - Nonqualified,Unauthorized,PERMA-FIX ENVIRONMENTAL SERVICES INC POLITICAL ACTION COMMITTEE,Corporation,GA
PERNOD RICARD USA LLC,C00380527,PAC - Qualified,Lobbyist/Registrant PAC,"PERNOD RICARD USA, LLC POLITICAL ACTION COMMITTEE",Corporation,NY
PERSONAL CARE PRODUCTS COUNCIL,C00113845,PAC - Qualified,Lobbyist/Registrant PAC,PERSONAL CARE PRODUCTS COUNCIL POLITICAL ACTION COMMITTEE,Trade Association,DC
PESTER MARKETING COMPANY ALTA FUELS LLC,C00529578,PAC - Nonqualified,Unauthorized,PESTER MARKETING COMPANY / ALTA FUELS LLC PAC,Corporation,CO
"PETER PAN SEAFOODS, INC.",C00100305,PAC - Qualified,Unauthorized,"PETER PAN SEAFOODS, INC. POLITICAL ACTION COMMITTEE  (1220 ASSOCIATES)",Corporation,WA
"GASOLINE DEALERS, INC.; ASSOC RETAIL",C00159244,PAC - Qualified,Unauthorized,PETROLEUM RETAILERS AND AUTO REPAIR ASSOCIATION,Trade Association,PA
PFIZER INC.,C00016683,PAC - Qualified,Lobbyist/Registrant PAC,PFIZER INC. PAC,Corporation,NY
PGA TOUR INC,C00196428,PAC - Qualified,Unauthorized,PGA TOUR INC POLITICAL ACTION COMMITTEE (PGA TOUR POLITICAL ACTION COMMITTEE),Membership Organization,FL
PG&E CORPORATION,C00177469,PAC - Qualified,Lobbyist/Registrant PAC,PG&E CORPORATION EMPLOYEES ENERGYPAC,Corporation,CA
PG&E CORPORATION,C00404079,PAC - Qualified,Lobbyist/Registrant PAC,PG&E CORPORATION FUND FOR ELECTRIC GENERATION - FEDERAL,Corporation,CA
PHARMACEUTICAL CARE MANAGEMENT ASSOCIATION,C00388819,PAC - Nonqualified,Lobbyist/Registrant PAC,PHARMACEUTICAL CARE MANAGEMENT ASSOCIATION POLITICAL ACTION COMMITTEE (PCMA PAC),Trade Association,DC
PHARMACEUTICAL RESEARCH & MANUFACTURERS OF AMERICA,C00021972,PAC - Qualified,Lobbyist/Registrant PAC,PHARMACEUTICAL RESEARCH & MANUFACTURERS OF AMERICA BETTER GOVERNMENT COMMITTEE,Trade Association,DC
,C00472019,PAC - Nonqualified,Unauthorized,PHARMATHENE INC POLITICAL ACTION COMMITTEE,Corporation,MD
"OTSUKA AMERICA, INC.",C00410654,PAC - Qualified,Lobbyist/Registrant PAC,PHARMAVITE LLC POLITICAL ACTION COMMITTEE (PHARMAVITE PAC),Corporation,CA
PHARMERICA CORPORATION,C00397455,PAC - Qualified,Lobbyist/Registrant PAC,PHARMERICA CORPORATION POLITICAL ACTION COMMITTEE PPAC,Corporation,KY
PHILADELPHIA BUILDING TRADES COUNCIL,C00457598,PAC - Nonqualified,Unauthorized,PHILADELPHIA BUILDING TRADES COUNCIL AFL-CIO POLITICAL ACTION COMMITTEE,Labor Organization,PA
PHILADELPHIA FEDERAL CREDIT UNION,C00360206,PAC - Qualified,Unauthorized,PHILADELPHIA FEDERAL CREDIT UNION PAC (PFCU-PAC),Trade Association,PA
LOCAL 274 HOTEL/RESTAURANT EMPLOYEES,C00165324,PAC - Qualified,Unauthorized,PHILADELPHIA JOINT BOARD POLITICAL ACTION COMMITTEE,Labor Organization,PA
PHILIPS NORTH AMERICA LLC,C00239780,PAC - Qualified,Lobbyist/Registrant PAC,PHILIPS NORTH AMERICA LLC POLITICAL ACTION COMMITTEE,Corporation,DC
PHILLIPS 66,C00513549,PAC - Qualified,Lobbyist/Registrant PAC,PHILLIPS 66 PAC,Corporation,DC
PHOENIX FIREFIGHTERS LOCAL 493,C00134676,PAC - Qualified,Unauthorized,"PHOENIX FIRE FIGHTERS, LOCAL 493, FIRE PAC COMMITTEE",Labor Organization,AZ
PHOENIX LAW ENFORCEMENT ASSOCIATION-POLITICAL ACTION COMMITTEE,C00274258,PAC - Qualified,Lobbyist/Registrant PAC,PHOENIX LAW ENFORCEMENT ASSOCIATION-POLITICAL ACTION COMMITTEE,Labor Organization,AZ
PHYSICIAN HOSPITALS OF AMERICA,C00394163,PAC - Qualified,Lobbyist/Registrant PAC,PHYSICIAN-LED HEALTHCARE FOR AMERICA POLITICAL ACTION COMMITTEE (PHA PAC),Trade Association,DC
,C00456335,PAC - Qualified,Unauthorized,PHYSICIANS MUTUAL INSURANCE COMPANY PAC,Corporation w/o capital stock,NE
NONE,C00425256,PAC - Nonqualified,Unauthorized,PICKERING INC PAC,Corporation,TN
THE PICTSWEET COMPANY,C00479972,PAC - Qualified,Unauthorized,PICTSWEET COMPANY GOOD GOVERNMENT COMMITTEE; THE,Corporation,TN
,C00430744,PAC - Qualified,Unauthorized,PIEDMONT HEALTHCARE P A PAC,Corporation,NC
"PIEDMONT STONE CENTER, PLLC",C00387696,PAC - Qualified,Unauthorized,"PIEDMONT STONE CENTER, PLLC",Corporation,NC
"PIEDMONT TRIAD ANESTHESIA, P.A.",C00435651,PAC - Nonqualified,Unauthorized,PIEDMONT TRIAD ANESTHESIA P A FEDERAL PAC,Corporation,NC
,C00340372,PAC - Nonqualified,Unauthorized,PIKE ELECTRIC INC FEDERAL PAC,Corporation,NC
PILGRIM'S PRIDE CORPORATION,C00113902,PAC - Qualified,Unauthorized,"PILGRIMS PRIDE CORPORATION POLITICAL ACTION COMMITTEE, INC.",Corporation,TX
PINNACLE BANCORP INC.,C00427427,PAC - Qualified,Unauthorized,PINNACLE BANCORP INC. PAC,Corporation,NE
"PINNACLE ENTERTAINMENT, INC.",C00394122,PAC - Nonqualified,Unauthorized,"PINNACLE ENTERTAINMENT, INC. PAC AKA PINNACLE ENTERTAINMENT PAC",Corporation,CA
PINNACLE WEST CAPITAL CORPORATION,C00015933,PAC - Qualified,Lobbyist/Registrant PAC,PINNACLE WEST CAPITAL CORPORATION PAC,Corporation,DC
"PIONEER NATURAL RESOURCES USA, INC.",C00420950,PAC - Qualified,Lobbyist/Registrant PAC,"PIONEER NATURAL RESOURCES USA, INC. FEDERAL POLITICAL ACTION COMMITTEE",Corporation,TX
PIPEFITTERS LOCAL UNION 533,C00206177,PAC - Qualified,Unauthorized,PIPEFITTERS LOCAL #533 VOLUNTEER POLITICAL FUND,Labor Organization,MO
PIPEFITTERS LOCAL 636,C00129627,PAC - Qualified,Unauthorized,PIPEFITTERS LOCAL 636 POLITICAL ACTION COMMITTEE,Labor Organization,MI
NONE,C00131706,PAC - Qualified,Unauthorized,PIPEFITTERS LOCAL UNION #524,Labor Organization,PA
UNITED ASSOCIATION POLITICAL EDUCATION COMMITTEE (UNITED ASSOCIATION OF JOURNEYMEN AND APP,C00190991,PAC - Qualified,Unauthorized,PIPEFITTERS LOCAL UNION NO 274 POLITICAL ACTION COMMITTEE,Labor Organization,NJ
PIPE TRADES DISTRICT COUNCIL NO. 36,C00521286,PAC - Qualified,Unauthorized,PIPE TRADES DISTRICT COUNCIL NO. 36 FEDERAL PAC,Labor Organization,CA
PISTACHIO FARMERS OF AMERICA,C00478388,PAC - Nonqualified,Unauthorized,PISTACHIO FARMERS OF AMERICA PAC,Membership Organization,CA
PITNEY BOWES INC.,C00339499,PAC - Qualified,Lobbyist/Registrant PAC,PITNEY BOWES INC. POLITICAL ACTION COMMITTEE,Corporation,CT
,C00390666,PAC - Nonqualified,Unauthorized,PITTSBURGH AIRPORT AREA CHAMBER OF COMMERCE PAC,Membership Organization,PA
PITTSBURGH TECHNOLOGY COUNCIL,C00339564,PAC - Nonqualified,Unauthorized,PITTSBURGH TECHNOLOGY COUNCIL PAC,Trade Association,PA
PLAINS COTTON COOPERATIVE ASS'N,C00152272,PAC - Nonqualified,Unauthorized,PLAINS COTTON COOPERATIVE ASSOCIATION EMPLOYEES' POLITICAL ACTION COMMITTEE,Cooperative,TX
PLANNED PARENTHOOD ACTION FUND INC.,C00314617,PAC - Qualified,Lobbyist/Registrant PAC,"PLANNED PARENTHOOD ACTION FUND INC PAC, DBA PLANNED PARENTHOOD FEDERAL PAC",Membership Organization,NY
PLANNED PARENTHOOD OF HOUSTON/SE TX,C00312082,PAC - Qualified,Unauthorized,PLANNED PARENTHOOD OF HOUSTON AND SOUTHEAST TEXAS PAC,Trade Association,TX
OPCMIA,C00134742,PAC - Qualified,Unauthorized,PLASTERERS' AND CEMENT MASONS' ACTION COMMITTEE,Labor Organization,MD
OPERATIVE PLASTERERS AND CEMENT MASONS INT'L ASSOC (CONNECTED ORG),C00536326,PAC - Nonqualified,Unauthorized,PLASTERERS CEMENT MASONS AND SHOP HANDS POLITICAL ACTION COMMITTEE,Labor Organization,MD
"PLASTICS INDUSTRY ASSOCIATION, INC.",C00309716,PAC - Qualified,Lobbyist/Registrant PAC,PLASTICS INDUSTRY ASSOCIATION POLITICAL ACTION COMMITTEE,Trade Association,DC
"PLS FINANCIAL SERVICES, INC.",C00450189,PAC - Qualified,Unauthorized,PLS FINANCIAL SVCS INC GOOD NEIGHBOR  POLITICAL ACTION COMMITTE (PLS GOOD NEIGHBOR PAC),Corporation,IL
PLUMBING & PIPEFITTING INDUSTRY,C00165233,PAC - Qualified,Unauthorized,PLUMBERS AND PIPEFITTERS LOCAL 619 POLITICAL ACTION CAMPAIGN FUND ,Labor Organization,MS
PLUMBERS & PIPEFITTERS LOCAL 25,C00137794,PAC - Qualified,Unauthorized,PLUMBERS AND PIPEFITTERS LOCAL UNION #25 FEDERAL PAC FUND,Labor Organization,IL
,C00329326,PAC - Nonqualified,Unauthorized,PLUMBERS AND PIPEFITTERS LOCAL UNION 51 POLITICAL ACTION COMMITTEE,Labor Organization,RI
,C00536383,PAC - Nonqualified,Unauthorized,PLUMBERS AND STEAMFITTERS LOCAL 159 FED PAC,Labor Organization,CA
PLUMBERS AND STEAMFITTERS LOCAL 467,C00209296,PAC - Qualified,Unauthorized,PLUMBERS AND STEAMFITTERS LOCAL 467 VOLUNTARY FEDERAL POLITICAL ACTION FUND,Labor Organization,CA
,C00396911,PAC - Nonqualified,Unauthorized,PLUMBERS AND STEAMFITTERS LOCAL NO 73 FEDERAL PAC FUND,Labor Organization,NY
PLUMBERS LOCAL 14 PAC FUND (PLUMBERS LOCAL UNION NO. 24),C00191213,PAC - Qualified,Unauthorized,PLUMBERS LOCAL 14 PAC FUND (PLUMBERS LOCAL UNION NO. 24),Labor Organization,NJ
NONE,C00143362,PAC - Qualified,Unauthorized,PLUMBERS LOCAL 519 POLITICAL ACTION COMMITTEE,Labor Organization,FL
,C00451088,PAC - Qualified,Unauthorized,PLUMBERS LOCAL 98 POLITICAL ACTION COMMITTEE,Labor Organization,MI
PLUMBERS LOCAL UNION NO. 1 - POLITICAL ACTION COMMITTEE,C00327478,PAC - Qualified,Unauthorized,PLUMBERS LOCAL UNION NO. 1 NYC-POLITICAL ACTION COMMITTEE,Labor Organization,NY
PLUMBERS LOCAL UNION NO. 24,C00252056,PAC - Qualified,Unauthorized,PLUMBERS LOCAL UNION NO. 24 POLITICAL ACTION COMMITTEE,Labor Organization,NJ
UNITED ASSOCIATION POLITICAL EDUCATION COMMITTEE,C00232835,PAC - Qualified,Unauthorized,PLUMBERS & PIPEFITTERS LOCAL #333 FEDERAL PAC FUND,Labor Organization,MI
UNITED ASSOCIATION POLITICAL EDUCATION COMMITTEE (UNITED ASSOCIATION OF JOURNEYMEN AND APP,C00155440,PAC - Qualified,Unauthorized,PLUMBERS & PIPEFITTERS LOCAL NO 9 POLITICAL ACTION COMMITTEE,Labor Organization,NJ
UNITED ASSOCIATION POLITICAL EDUCATION COMMITTEE (UNITED ASSOCIATION OF JOURNEYMEN AND APP,C00192849,PAC - Qualified,Unauthorized,PLUMBERS & PIPEFITTERS LOCAL UNION 74 POLITICAL ACTION COMMITTEE,Labor Organization,DE
LOCAL UNION 295 UNITED ASS'N PLUMBERS & PIPEFITTERS U.S. & CANADA,C00147181,PAC - Qualified,Unauthorized,PLUMBERS & PIPEFITTERS LOCAL UNION NO. 295 PAC,Labor Organization,FL
UNITED ASSOCIATION POLITICAL EDUCATION COMMITTEE,C00347500,PAC - Qualified,Unauthorized,PLUMBERS & PIPEFITTERS LOCAL UNION NO 522 POLITICAL ACTION FUND,Labor Organization,KY
"PLUMBERS, PIPE FITTERS & MECHANICAL EQUIPMENT SERVICE LOCAL UNION 392",C00242024,PAC - Qualified,Unauthorized,PLUMBERS PIPEFITTERS & M E S LOCAL UNION 392 PAC,Labor Organization,OH
PLUMBERS & PIPEFITTERS UNION LOCAL 675 AFL-CIO POLITICAL ACTION COMMITTEE,C00225151,PAC - Qualified,Unauthorized,PLUMBERS & PIPEFITTERS UNION LOCAL 675 AFL-CIO POLITICAL ACTION COMMITTEE,Labor Organization,HI
PLUMBERS UNION LOCAL 690,C00252825,PAC - Qualified,Unauthorized,PLUMBERS UNION LOCAL 690 POLITICAL ACTION COMMITTEE,Labor Organization,PA
PLYMOUTH ENERGY LLC PAC,C00483974,PAC - Nonqualified,Unauthorized,PLYMOUTH ENERGY LLC PAC,Corporation,IA
PMI MORTGAGE INSURANCE COMPANY,C00347112,PAC - Qualified,Unauthorized,PMI MORTGAGE INSURANCE COMPANY FEDERAL PAC,Corporation,CA
POKER PLAYERS ALLIANCE,C00448688,PAC - Qualified,Lobbyist/Registrant PAC,POKER PLAYERS ALLIANCE POLITICAL ACTION COMMITTEE,Membership Organization,DC
POLARIS INDUSTRIES INC,C00279497,PAC - Qualified,Lobbyist/Registrant PAC,POLARIS INDUSTRIES POLITICAL PARTICIPATION PROGRAM,Corporation,MN
POLICE BENEVOLENT ASSOC POLICE DEPARTMENT COUNTY OF NASSAU NY,C00457218,PAC - Nonqualified,Unauthorized,POLICE BENEVOLENT ASSOC POLICE DEPARTMENT COUNTY OF NASSAU  NY FEDERAL PAC,Labor Organization,NY
NONE,C00232611,PAC - Qualified,Unauthorized,POLITICAL ACTION COMMITTEE OF CHERRY HILL NEW JERSEY,Membership Organization,NJ
CRITICAL CARE SYSTEMS INTERNATIONAL,C00272864,PAC - Nonqualified,Unauthorized,POLITICAL ACTION COMMITTEE OF CRITICAL CARE SYSTEMS INTERNATIONAL INC,Corporation,NH
AMERICAN ASSOCIATION OF ORTHOPAEDIC SURGEONS,C00343137,PAC - Qualified,Lobbyist/Registrant PAC,POLITICAL ACTION COMMITTEE OF THE AMERICAN ASSOCIATION OF ORTHOPAEDIC SURGEONS--PAC OF AAOS,Membership Organization,DC
ARIZONA HOSPITAL AND HEALTHCARE ASSOCIATION,C00217687,PAC - Qualified,Lobbyist/Registrant PAC,POLITICAL ACTION COMMITTEE OF THE ARIZONA HOSPITAL AND HEALTHCARE ASSOCIATION,Trade Association,AZ
INTERNATIONAL ALLIANCE OF THEATRICAL STAGE EMPLOYEES,C00344325,PAC - Qualified,Lobbyist/Registrant PAC,POLITICAL ACTION COMMITTEE OF THE INTERNATIONAL ALLIANCE OF THEATRICAL STAGE EMPLOYEES,Labor Organization,NY
THE BANK OF THE NEW YORK MELLON CORPORATION,C00494534,PAC - Qualified,Lobbyist/Registrant PAC,POLITICAL ACTION COMMITTEE/THE BANK OF NEW YORK MELLON CORPORATION-FEDERAL(BNY MELLON-FED),Corporation,PA
,C00023754,PAC - Qualified,Unauthorized,POLITICAL ACTION COUNCIL OF EDUCATORS(UNITED TEACHERS-LOS ANGELES),Labor Organization,CA
SEAFARERS POLITICAL ACTIVITY DONATION,C00286401,PAC - Qualified,Unauthorized,POLITICAL AND LEGISLATIVE ORGANIZATION ON WATCH COMM - SEAFARERS INT'L UNION OF NA-AGLIW,Labor Organization,MD
INTERNATIONAL UNION OF OPERATING ENGINEERS LOCAL 18,C00065870,PAC - Qualified,Unauthorized,POLITICAL EDUCATION PATTERNS POLITICAL ARM INTL UNION OPERATING ENG LOCAL 18,Labor Organization,OH
NONE,C00287748,PAC - Nonqualified,Unauthorized,POLITICAL LEAGUE OF THE AMERICAN TRAIN DISPATCHERS ASSOCIATION,Labor Organization,OH
POLSINELLI PAC,C00445981,PAC - Qualified,Unauthorized,POLSINELLI PAC,Corporation,MO
N/A,C00503813,PAC - Nonqualified,Unauthorized,"POOR PEOPLES PAC, THE",Membership Organization,FL
"POPULAR, INC.",C00441303,PAC - Nonqualified,Unauthorized,POPULAR INC PAC,Corporation,DC
"POPULUS FINANCIAL GROUP, INC.",C00392290,PAC - Qualified,Lobbyist/Registrant PAC,"POPULUS FINANCIAL GROUP, INC. PAC",Corporation,TX
PORTLAND CEMENT ASSOCIATION,C00237065,PAC - Qualified,Lobbyist/Registrant PAC,PORTLAND CEMENT ASSOCIATION INC. (CEMENT PAC),Trade Association,DC
PORTLAND GENERAL ELECTRIC CO.,C00381020,PAC - Qualified,Lobbyist/Registrant PAC,PORTLAND GENERAL ELECTRIC CO. BI-PARTISAN COMM. FOR EFFECTIVE GOVT,Corporation,OR
"PORTS AMERICA GROUP, INC.",C00396812,PAC - Nonqualified,Unauthorized,"PORTS AMERICA GROUP, INC. DBA PORTS AMERICA PAC",Corporation,CA
POTLATCHDELTIC CORPORATION,C00041608,PAC - Qualified,Lobbyist/Registrant PAC,POTLATCHDELTIC CORPORATION POLITICAL ACTION COMMITTEE (POTLATCHDELTIC PAC),Corporation,WA
EDISON ELECTRIC INSTITUTE,C00095869,PAC - Qualified,Lobbyist/Registrant PAC,POWERPAC OF THE EDISON ELECTRIC INSTITUTE,Trade Association,DC
ONCOR POLITICAL ACTION COMMITTEE OF ONCOR ELECTRIC DELIVERY ADMINISTRATION CORP.,C00255950,PAC - Qualified,Lobbyist/Registrant PAC,POWER POLITICAL ACTION COMMITTEE OF VISTRA ENERGY,Corporation w/o capital stock,TX
"POWERS, PYLES, SUTTER & VERVILLE PC",C00302687,PAC - Nonqualified,Lobbyist/Registrant PAC,"POWERS, PYLES, SUTTER & VERVILLE PC PAC",Corporation,DC
PPG INDUSTRIES INC.,C00034298,PAC - Qualified,Lobbyist/Registrant PAC,PPG INDUSTRIES INC. PAC,Corporation,PA
LG&E - KU POLITICAL ACTION COMMITTEE,C00228106,PAC - Qualified,Lobbyist/Registrant PAC,PPL CORPORATION PEOPLE FOR GOOD GOVERNMENT,Corporation,PA
PRAGMATICS INCORPORATED POLITICAL ACTION COMMITTEE,C00421487,PAC - Qualified,Unauthorized,PRAGMATICS INCORPORATED POLITICAL ACTION COMMITTEE,Corporation,VA
PRECISION MACHINED PRODUCTS ASSOCIATION POLITICAL ACTION COMMITTEE,C00110858,PAC - Qualified,Unauthorized,PRECISION MACHINED PRODUCTS ASSOCIATION POLITICAL ACTION COMMITTEE,Trade Association,OH
PRECISION METALFORMING ASSOCIATION,C00082271,PAC - Qualified,Unauthorized,PRECISION METALFORMING ASSOCIATION VOICE OF THE INDUSTRY COMMITTEE (PMAVIC),Trade Association,OH
PREFERRED CARE PARTNERS HOLDING CORP,C00490854,PAC - Nonqualified,Unauthorized,PREFERRED CARE PARTNERS HOLDING CORP GOOD GOVERNMENT FUND,Corporation,FL
,C00457606,PAC - Qualified,Unauthorized,PREIT-RUBIN INC POLITICAL ACTION COMMITTEE,Corporation,PA
PREMERA BLUE CROSS,C00409227,PAC - Qualified,Unauthorized,PREMERA BLUE CROSS POLITICAL ACTION COMMITTEE/PREMERA PAC,Corporation,WA
"PREMIER, INC.",C00346288,PAC - Qualified,Unauthorized,PREMIER INC. EMPLOYEES' CIVIC ACTION FUND,Corporation,DC
PREMIUM CIGAR ASSOCIATION,C00450239,PAC - Qualified,Unauthorized,PREMIUM CIGAR ASSOCIATION POLITICAL ACTION COMMITTEE (PREMIUM CIGAR PAC),Trade Association,DC
NONE,C00107235,PAC - Qualified,Lobbyist/Registrant PAC,PRICEWATERHOUSECOOPERS POLITICAL ACTION COMMITTEE I,Corporation,DC
NONE,C00388132,PAC - Qualified,Unauthorized,PRIDE MOBILITY PRODUCTS CORP PAC,Corporation,PA
BURSON COHN & WOLFE,C00201863,PAC - Qualified,Lobbyist/Registrant PAC,PRIME POLICY GROUP LLC/BURSON COHN & WOLFE POLITICAL ACTION COMMITTEE,Corporation,DC
"PRIMERICA, INC.",C00521914,PAC - Qualified,Unauthorized,PRIMERICA INC POLITICAL ACTION COMMITTEE (PRIMERICA PAC),Corporation,GA
NONE,C00498105,PAC - Qualified,Lobbyist/Registrant PAC,PRIME THERAPEUTICS LLC EMPLOYEE PAC (PRIMEPAC),Corporation,MN
,C00056564,PAC - Qualified,Unauthorized,PRIMIENT PAC OF PRIMARY PRODUCTS INGREDIENTS AMERICAS LLC,Corporation,IL
PRINCESS CRUISES AND TOURS INC,C00365031,PAC - Qualified,Unauthorized,PRINCESS CRUISES/TOURS INC/ALASKA HOTEL PROPERTIES LLC PAC (PRINCESS CRUISES/TOURS INC PAC,Corporation,CA
PRINCIPAL LIFE INSURANCE COMPANY,C00128918,PAC - Qualified,Lobbyist/Registrant PAC,PRINCIPAL LIFE INSURANCE COMPANY POLITICAL ACTION COMMITTEE,Corporation,IA
PRINTING UNITED ALLIANCE,C00018028,PAC - Qualified,Lobbyist/Registrant PAC,PRINTING UNITED ALLIANCE POLITICAL ACTION COMMITTEE (PRINTPAC),Trade Association,VA
PRIVATE CARE ASSOCIATION,C00498154,PAC - Qualified,Unauthorized,"PRIVATE CARE ASSOCIATION POLITICAL ACTION COMMITTEE, THE",Trade Association,NC
NONE,C00224808,PAC - Qualified,Unauthorized,PRO-AMERICA PAC,Membership Organization,VA
"PROCURE TREATMENT CENTERS, INC.",C00476812,PAC - Nonqualified,Unauthorized,PROCURE TREATMENT CENTERS INC. PAC,Corporation,NY
PRODUCERS RICE MILL INC,C00378083,PAC - Qualified,Unauthorized,PRODUCERS RICE MILL INC PAC,Corporation,AR
PROFESSIONAL ASSOCIATION FOR CUSTOMER ENGAGEMENT PAC,C00397083,PAC - Qualified,Unauthorized,PROFESSIONAL ASSOCIATION FOR CUSTOMER ENGAGEMENT PAC,Corporation,IN
PROFESSIONAL AVIATION SAFETY SPECIALISTS,C00286807,PAC - Qualified,Unauthorized,PROFESSIONAL AVIATION SAFETY SPECIALISTS PAC,Labor Organization,DC
PROFESSIONAL BAIL AGENTS OF THE UNITED STATES,C00416677,PAC - Nonqualified,Unauthorized,PROFESSIONAL BAIL AGENTS OF THE UNITED STATES PAC AKA PBUS PAC,Trade Association,DC
PROFESSIONAL ENGINEERS IN CALIFORNIA GOVERNMENT,C00459800,PAC - Qualified,Unauthorized,PROFESSIONAL ENGINEERS IN CALIFORNIA GOVERNMENT FEDERAL PAC (PECG FED-PAC),Labor Organization,CA
NATIONAL ASSOCIATION OF PROFESSIONAL INSURANCE AGENTS,C00004994,PAC - Qualified,Lobbyist/Registrant PAC,PROFESSIONAL INSURANCE AGENTS POLITICAL ACTION COMMITTEE (PIAPAC),Trade Association,VA
"PROFESSIONAL SERVICE INDUSTRIES, INC.",C00498527,PAC - Nonqualified,Unauthorized,"PROFESSIONAL SERVICE INDUSTRIES, INC. POLITICAL ACTION COMMITTEE (PSI PAC)",Corporation,CA
PROFESSIONAL SERVICES COUNCIL,C00132456,PAC - Qualified,Lobbyist/Registrant PAC,PROFESSIONAL SERVICES COUNCIL POLITICAL ACTION COMMITTEE,Trade Association,VA
PROLIANCE SURGEONS INC,C00540112,PAC - Qualified,Unauthorized,PROLIANCE SURGEONS POLITICAL ACTION COMMITTE,Corporation,WA
BLANK,C00104174,PAC - Nonqualified,Unauthorized,PRO-LIFE ACTION COUNCIL,Membership Organization,IA
PROLOGIC INC PAC,C00369835,PAC - Qualified,Unauthorized,PROLOGIC INC PAC,Corporation,WV
"THE PROTECTIVE GROUP, INC.",C00423996,PAC - Nonqualified,Unauthorized,PROTECTIVE GROUP INC POLITICAL ACTION COMMITTEE; THE,Corporation,FL
PROTECTIVE LIFE CORPORATION,C00161414,PAC - Qualified,Lobbyist/Registrant PAC,PROTECTIVE LIFE CORPORATION FEDERAL POLITICAL ACTION COMMITTEE ('PROTECTPAC'),Corporation,AL
PROTECTSENIORS.ORG,C00426361,PAC - Qualified,Unauthorized,PROTECTSENIORS.ORG POLITICAL ACTION COMMITTEE,Membership Organization,FL
,C00229328,PAC - Qualified,Unauthorized,PROVIDENT SAVINGS BANK POLITICAL ACTION COMMITTEE (PROVPAC),Corporation w/o capital stock,NJ
"PRUDENTIAL FINANCIAL, INC.",C00127779,PAC - Qualified,Lobbyist/Registrant PAC,PRUDENTIAL FINANCIAL INC. FEDERAL POLITICAL ACTION COMMITTEE (AKA - PRUDENTIAL FEDERAL PAC),Corporation,NJ
"PRUDENTIAL FINANCIAL, INC.",C00493304,PAC - Qualified,Lobbyist/Registrant PAC,"PRUDENTIAL FINANCIAL, INC. STATE & FEDERAL POLITICAL ACTION COMMITTEE (AKA PRUDENTIAL STATE & FEDERAL PAC)",Corporation,NJ
PSS WORLD MEDICAL INC,C00472829,PAC - Nonqualified,Unauthorized,PSS WORLD MEDICAL INC PAC,Corporation,FL
"PSYCHIATRIC SOLUTIONS, INC.",C00407684,PAC - Qualified,Unauthorized,"PSYCHIATRIC SOLUTIONS, INC. FED PAC",Corporation,TN
AMERICAN PSYCHOLOGICAL ASSOCIATION SERVICES INC. (APASI),C00522094,PAC - Qualified,Lobbyist/Registrant PAC,PSYCHOLOGY PAC OF AMERICAN PSYCHOLOGICAL ASSOCIATION SERVICES INC.,Trade Association,DC
NONE,C00224493,PAC - Qualified,Unauthorized,PUBLIC AFFAIRS PAC,Membership Organization,VA
DISTRICT COUNCIL 37 AFSCME PUBLIC EMPLOYEES ORGANIZED FOR POL & LEG EQUALITY (DC37PEOPLE),C00379305,PAC - Qualified,Unauthorized,PUBLIC EMPLOYEES UNION LOCAL ONE FEDERAL POLITICAL EDUCATION COMMITTEE,Labor Organization,CA
PUBLIC SERVICE CO OF NM,C00025395,PAC - Qualified,Lobbyist/Registrant PAC,PUBLIC SERVICE COMPANY OF NEW MEXICO RESPONSIBLE CITIZENS GROUP - FEDERAL,Corporation,NM
PUBLIC SERVICE ENTERPRISE GROUP,C00383489,PAC - Qualified,Lobbyist/Registrant PAC,PUBLIC SERVICE ENTERPRISE GROUP INC. POLITICAL ACTION COMMITTEE (PEGPAC),Corporation,NJ
CONSURGO LLC,C00443259,PAC - Nonqualified,Unauthorized,PUBLIUS*PAC,Corporation,TX
"PUBLIX SUPER MARKETS, INC.",C00400705,PAC - Qualified,Lobbyist/Registrant PAC,"PUBLIX SUPER MARKETS, INC. ASSOCIATES POLITICAL ACTION COMMITTEE",Corporation,FL
PUGET SOUND ENERGY INC.,C00101592,PAC - Qualified,Lobbyist/Registrant PAC,PUGET SOUND ENERGY INC. PAC FOR GOOD GOVERNMENT,Corporation w/o capital stock,WA
NONE,C00230201,PAC - Nonqualified,Unauthorized,PULLMAN  & COMLEY POLITICAL ACTION COMMITTEE,Membership Organization,CT
PURDUE PHARMA INC.,C00370643,PAC - Qualified,Lobbyist/Registrant PAC,PURDUE PHARMA INC. POLITICAL ACTION COMMITTEE (PURDUE PAC),Corporation,CT
PURPOSE FINANCIAL INC.,C00429001,PAC - Qualified,Lobbyist/Registrant PAC,PURPOSE FINANCIAL INC. PAC,Corporation,SC
"PUTNAM INVESTMENTS, LLC",C00289595,PAC - Qualified,Unauthorized,"PUTNAM INVESTMENTS, LLC POLITICAL ACTION COMMITTEE ('PUTNAM PAC')",Corporation,MA
"QC HOLDINGS, INC.",C00411769,PAC - Qualified,Unauthorized,"QC HOLDINGS, INC. POLITICAL ACTION COMMITTEE",Corporation,KS
,C00485730,PAC - Qualified,Unauthorized,QEP RESOURCES INC POLITICAL ACTION COMMITTEE,Corporation,CO
"QORVIS COMMUNICATIONS, LLC",C00398552,PAC - Nonqualified,Unauthorized,"QORVIS COMMUNICATIONS, LLC POLITICAL ACTION COMMITTEE 'Q-PAC'",Corporation,DC
QUAD COUNTY CORN PROCESSORS COOPERATIVE,C00526194,PAC - Nonqualified,Unauthorized,QUAD COUNTY CORN PROCESSORS COOPERATIVE POLITICAL ACTION COMMITTEE,Cooperative,IA
,C00530659,PAC - Nonqualified,Unauthorized,QUAD/GRAPHICS INC FEDERAL POLITICAL ACTION COMMITTEE,Corporation,WI
QUALCOMM INCORPORATED,C00339085,PAC - Qualified,Lobbyist/Registrant PAC,QUALCOMM INCORPORATED POLITICAL ACTION COMMITTEE (QPAC),Corporation,DC
QUEST DIAGNOSTICS INCORPORATED,C00329185,PAC - Qualified,Lobbyist/Registrant PAC,QUEST DIAGNOSTICS INCORPORATED POLITICAL ACTION COMMITTEE,Corporation,NJ
"QURATE RETAIL, INC.",C00442434,PAC - Qualified,Unauthorized,"QURATE RETAIL, INC. PAC",Corporation,CO
CENTURYLINK INC. EMPLOYEES' POLITICAL ACTION COMMITTEE,C00237156,PAC - Qualified,Lobbyist/Registrant PAC,QWEST COMMUNICATIONS INTERNATIONAL INC POLITICAL ACTION COMMITTEE,Corporation,DC
"RADIANCE TCEHNOLOGIES, INC",C00372979,PAC - Qualified,Unauthorized,"RADIANCE TECHNOLOGIES, INC. POLITICAL ACTION COMMITTEE",Corporation,AL
"RADIAN GROUP, INC.",C00302166,PAC - Qualified,Lobbyist/Registrant PAC,"RADIAN GROUP, INC. POLITICAL ACTION COMMITTEE (RAD PAC)",Corporation,PA
NONE,C00467373,PAC - Qualified,Unauthorized,RADIOLOGICAL SOCIETY OF CONNECTICUT FEDERAL PAC,Trade Association,CT
RAILAMERICA INC.,C00362095,PAC - Qualified,Unauthorized,RAILAMERICA INC FEDERAL POLITICAL ACTION COMMITTEE,Corporation,FL
NONE,C00261933,PAC - Nonqualified,Unauthorized,RAILWAY SUPPLY INSTITUTE POLITICAL ACTION COMITTEE,Trade Association,DC
RAIN AND HAIL INSURANCE SOCIETY,C00279505,PAC - Qualified,Unauthorized,RAIN AND HAIL INSURANCE SOCIETY POLITICAL ACTION COMMITTEE,Trade Association,IA
,C00128686,PAC - Qualified,Unauthorized,RAISIN BARGAINING ASS'N FEDERAL POLITICAL ACTION COMMITTEE,Cooperative,CA
R & L CARRIERS INC,C00446831,PAC - Nonqualified,Unauthorized,R AND L CARRIERS INC FEDERAL PAC,Corporation,OH
"RAYONIER, INC.",C00451757,PAC - Qualified,Unauthorized,"RAYONIER, INC. GOOD GOVERNMENT COMMITTEE",Corporation,FL
UNITED TECHNOLOGIES CORPORATION,C00035683,PAC - Qualified,Lobbyist/Registrant PAC,RAYTHEON TECHNOLOGIES CORPORATION PAC (FORMERLY UTC PAC),Corporation,DC
RBC USA HOLDCO CORPORATION FEDERAL POLITICAL ACTION COMMITTEE,C00517052,PAC - Qualified,Lobbyist/Registrant PAC,RBC USA HOLDCO CORPORATION FEDERAL POLITICAL ACTION COMMITTEE,Corporation,NY
RCN CORPORATION,C00215533,PAC - Nonqualified,Unauthorized,RCN EMPLOYEES GOOD GOVERNMENT COMMITTEE,Corporation,VA
REAL ESTATE INVESTMENT SECURITIES ASSOCIATION,C00468215,PAC - Nonqualified,Lobbyist/Registrant PAC,REAL ESTATE INVESTMENT SECURITIES ASSOCIATION PAC (REISA PAC),Trade Association,IN
"REAL ESTATE SERVICES PROVIDERS COUNCIL, INC.",C00369868,PAC - Qualified,Lobbyist/Registrant PAC,REAL ESTATE SERVICES PROVIDERS COUNCIL INC POLITICAL ACTION COMMITTEE,Membership Organization,DC
COALITION OF FREEDOM,C00506238,PAC - Nonqualified,Unauthorized,REBIRTH OF AMERICA,Membership Organization,OH
RECOVERY EDUCATION ADVOCACY LEADERSHIP,C00506220,PAC - Nonqualified,Unauthorized,RECOVERY EDUCATION ADVOCACY LEADERSHIP PAC,Corporation w/o capital stock,MI
RECREATIONAL FISHING ALLIANCE PAC,C00363812,PAC - Qualified,Unauthorized,RECREATIONAL FISHING ALLIANCE PAC,Membership Organization,NJ
"RED GOLD, INC. POLITICAL ACTION COMMITTEE",C00390112,PAC - Qualified,Unauthorized,"RED GOLD, INC. POLITICAL ACTION COMMITTEE",Corporation,IN
